title,location,filename,medium,price,description,featured
Midday Crossing,boston,midday-crossing.jpg,Acrylic on Canvas,300,"Pedestrians cross a downtown Boston intersection during the middle of the day. Figures move in multiple directions as storefronts, street signs, and passing traffic frame the scene.",yes
Bathers at Nantasket Beach No 1,misc,bathers-at-nantasket-beach-no-1.jpg,Acrylic on Canvas,300,"Families and children gather along the shoreline at Nantasket Beach on a summer afternoon. Some wade in the shallows while others stand back, watching the water and the activity around them.",yes
Bathers at Nantasket Beach No 2,misc,bathers-at-nantasket-beach-no-2.jpg,Acrylic on Canvas,300,"A wide view of Nantasket Beach on a busy summer day, with beachgoers seated in chairs and tents while others move between sand and surf. The scene captures the density and casual pace of a crowded shoreline.",yes
Downtown Crossing No 1,boston,downtown-crossing-no-1.jpg,Acrylic on Canvas,300,Downtown Crossing with pedestrians crossing between shops and buildings. The scene captures the steady flow of foot traffic and everyday movement through the city.,yes
Fifth Floor View,boston,fifth-floor-view.jpg,Acrylic on Canvas,300,"A city intersection viewed from above, showing cars stopped in traffic and pedestrians crossing at the corner. Buildings, sidewalks, and street markings define the structure of the scene.",no
Hingham Farmers Market,misc,hingham-farmers-market.jpg,Acrylic on Canvas,300,"Shoppers move through an outdoor market in Hingham, Massachusetts. Vendor tents, food stands, and small groups of people create a busy scene of casual browsing, conversation, and everyday activity.",no
Lunchtime Stroll,boston,luchtime-stroll.jpg,Acrylic on Canvas,300,"Pedestrians walk along a downtown Boston street during the lunch hour. Tall buildings, storefronts, and signage frame the steady movement of people passing through the city.",no
Northend Scene,boston,northend-scene.jpg,Acrylic on Canvas,300,"Pedestrians walk along a narrow street in Boston’s North End, passing storefronts, signs, and a busy intersection. Streetlights, traffic signals, and parked cars frame the scene as people move through the neighborhood.",yes
Outside Peet's,boston,outside-peet's.jpg,Acrylic on Canvas,300,"People gather and pass by outside a coffee shop on a busy downtown street. Pedestrians wait at the corner while others move through the intersection, with storefronts and traffic framing the scene.",yes